redundancy_complete/200pct/S3/Large-scale-or/UFLP_testing/UFLP13/service_centers_fixed_costs.csv

Service Center,four_periods_ago_Fixed_Opening_Cost,fixed_opening_cost_previous_period,Fixed Opening Cost,three_periods_ago_Fixed_Opening_Cost,two_periods_ago_Fixed_Opening_Cost
SC1,418.68072,383.75215,385.1,443.51967,427.92312
SC2,524.66652,489.81258,546.3,521.60724,634.63671
SC3,558.56224,428.14048,485.2,496.06848,549.68308
SC4,480.09434,359.15215,448.1,469.11589,446.62127
SC5,298.62574,276.87863,324.1,306.98752,309.35345
SC6,372.87368,357.35887,323.9,371.1894,303.8182
SC7,273.01720,341.95345,296.5,324.3710,316.3655
SC8,509.68477,497.29678,522.7,497.66267,556.83231
SC9,370.98516,373.99145,448.7,433.48907,482.12815
SC10,458.69034,458.97756,478.7,539.39916,516.37369

outputs/optimization_0927_20261006/few_shot_only_nrm_direct_formulation_r1/automatic/results_cases/AUTO/OR-089/6b99b54946a7b0a1/model.md

##### Parameters

\[
\begin{align*}
f_{\text{SC1}} &= 385.1 \\
f_{\text{SC2}} &= 546.3 \\
f_{\text{SC3}} &= 485.2 \\
f_{\text{SC4}} &= 448.1 \\
f_{\text{SC5}} &= 324.1 \\
f_{\text{SC6}} &= 323.9 \\
f_{\text{SC7}} &= 296.5 \\
f_{\text{SC8}} &= 522.7 \\
f_{\text{SC9}} &= 448.7 \\
f_{\text{SC10}} &= 478.7 \\
\end{align*}
\]